Description,Price,Ratings,Review Count,Url
DIBAOLONG Womens Yoga Sweatpants Loose Workout Joggers Pants Comfy Lounge Pants with Pockets,$21.99,4.3 out of 5 stars,"4,364",https://www.amazon.com//DIBAOLONG-Workout-Running-Joggers-Sweatpants/dp/B07YHHT58F/ref=sr_1_34?dchild=1&keywords=joggers&qid=1612402325&sr=8-34
Champion Women's Jogger,$19.87,4.6 out of 5 stars,"5,740",https://www.amazon.com//Champion-Womens-Powerblend-Granite-Heather/dp/B07KKTG2JB/ref=sr_1_35?dchild=1&keywords=joggers&qid=1612402325&sr=8-35
Southpole Men's Basic Stretch Twill Jogger Pants-Reg and Big & Tall Sizes,$21.99,4.4 out of 5 stars,"4,373",https://www.amazon.com//Southpole-Basic-Stretch-Jogger-Medium/dp/B01N39OH6N/ref=sr_1_36?dchild=1&keywords=joggers&qid=1612402325&sr=8-36
Amazon Essentials Men's Jogger,$17.00,4.6 out of 5 stars,"11,194",https://www.amazon.com//Amazon-Essentials-Standard-Fleece-Jogger/dp/B07P7KYGX6/ref=sr_1_37?dchild=1&keywords=joggers&qid=1612402325&sr=8-37
LEINIDINA Women’s Jogger Pants High Waisted Sweatpants with Pockets Tapered Casual Lounge Pants Loose Track Cuff Leggings,$23.99,4.5 out of 5 stars,706,https://www.amazon.com//LEINIDINA-Waisted-Sweatpants-Pockets-Leggings/dp/B08GHMCD38/ref=sr_1_38?dchild=1&keywords=joggers&qid=1612402325&sr=8-38
WT02 Men's Jogger,$17.41,4.4 out of 5 stars,"6,145",https://www.amazon.com//WT02-Basic-Jogger-Fleece-Medium/dp/B07BS4LZFP/ref=sr_1_39?dchild=1&keywords=joggers&qid=1612402325&sr=8-39
Soothfeel Women’s Joggers with Phone Pockets High Waist Athletic Workout Yoga Tapered Lounge Pants Joggers for Women,$26.99,4.5 out of 5 stars,75,https://www.amazon.com//Soothfeel-Joggers-Pockets-Athletic-Workout/dp/B08LKRRM6G/ref=sr_1_40?dchild=1&keywords=joggers&qid=1612402325&sr=8-40
Under Armour Men's Sportstyle Tricot Joggers,$39.99,4.7 out of 5 stars,"5,009",https://www.amazon.com//Under-Armour-Sportstyle-Jogger-Heather/dp/B01MEHHVTO/ref=sr_1_41?dchild=1&keywords=joggers&qid=1612402325&sr=8-41
Women's Cinch Bottom Sweatpants Pockets High Waist Sporty Gym Athletic Fit Jogger Pants Lounge Trousers,$25.99,4.0 out of 5 stars,"5,321",https://www.amazon.com//Womens-Sweatpants-Pockets-Athletic-Trousers/dp/B0874GK7Q7/ref=sr_1_42?dchild=1&keywords=joggers&qid=1612402325&sr=8-42
Goodthreads Men's Jogger,$25.00,4.2 out of 5 stars,"1,716",https://www.amazon.com//Goodthreads-Mens-Fleece-Jogger-Medium/dp/B07L32RYLD/ref=sr_1_43?dchild=1&keywords=joggers&qid=1612402325&sr=8-43
czzstance Men's Sweatpants Cotton Jogger Pants with Pockets Casual Loose Fit Athletic Drawstring Training Pants,$29.99,4.6 out of 5 stars,522,https://www.amazon.com//czzstance-Sweatpants-Athletic-Drawstring-Training/dp/B08GYZZKFC/ref=sr_1_44?dchild=1&keywords=joggers&qid=1612402325&sr=8-44
Southpole Big Boys' Jogger Fleece Pants in Basic Colors,$14.41,4.6 out of 5 stars,"4,502",https://www.amazon.com//Southpole-Jogger-Fleece-Colors-Marled/dp/B06XS4C9FF/ref=sr_1_45?dchild=1&keywords=joggers&qid=1612402325&sr=8-45
Champion Women's Powerblend Jogger,$29.00,4.5 out of 5 stars,664,https://www.amazon.com//Champion-Womens-Powerblend-Jogger-Black-GF937/dp/B07MTHYMJQ/ref=sr_1_46?dchild=1&keywords=joggers&qid=1612402325&sr=8-46
"PHISOCKAT Women's Joggers Pants High Waist Athletic Joggers with Pockets Tapered Lounge Pants for Workout, Running, Yoga",$21.95,4.8 out of 5 stars,40,https://www.amazon.com//PHISOCKAT-Joggers-Athletic-Pockets-Tapered/dp/B08QTZKXMN/ref=sr_1_47?dchild=1&keywords=joggers&qid=1612402325&sr=8-47
adidas Men's Tiro 19 Training Pants,$35.00,4.7 out of 5 stars,"23,147",https://www.amazon.com//adidas-Tiro19-Training-Pants-Black/dp/B07CNBLX7G/ref=sr_1_48?dchild=1&keywords=joggers&qid=1612402325&sr=8-48
Champion Boys Sweatpant Heritage Collection Slim Fit Brushed Fleece Big and Little Boys Kids,$34.99,4.4 out of 5 stars,"4,577",https://www.amazon.com//Champion-Sweatpant-Heritage-Collection-Brushed/dp/B07SZ38S4Q/ref=sr_1_49?dchild=1&keywords=joggers&qid=1612402325&sr=8-49
Champion Men's Powerblend Graphic Jogger,$24.00,4.7 out of 5 stars,933,https://www.amazon.com//Champion-Powerblend-Graphic-Jogger-549314/dp/B07SZMLJRJ/ref=sr_1_50?dchild=1&keywords=joggers&qid=1612402325&sr=8-50
Nike Club Men's Training Joggers,$53.38,5.0 out of 5 stars,4,https://www.amazon.com//Nike-Training-Joggers-Dorado-Large/dp/B08PP5H2CW/ref=sr_1_51?dchild=1&keywords=joggers&qid=1612402325&sr=8-51
Champion Women's Jersey Pocket Pant,$15.38,4.2 out of 5 stars,"7,143",https://www.amazon.com//Champion-Womens-Jersey-Pocket-Black/dp/B011B7CS6Y/ref=sr_1_52?dchild=1&keywords=joggers&qid=1612402325&sr=8-52
DIBAOLONG Womens Yoga Sweatpants Loose Workout Harem Joggers Casual Comfy Lounge Pajama Pants with Pockets,$23.99,4.5 out of 5 stars,58,https://www.amazon.com//DIBAOLONG-Sweatpants-Workout-Joggers-Pockets/dp/B08P4QJ1TN/ref=sr_1_53?dchild=1&keywords=joggers&qid=1612402325&sr=8-53
"BROKIG Mens Lightweight Gym Jogger Pants,Men's Workout Sweatpants with Zip Pocket",$26.38,4.5 out of 5 stars,587,https://www.amazon.com//gp/slredirect/picassoRedirect.html/ref=pa_sp_btf_aps_sr_pg1_1?ie=UTF8&adId=A01758833HAFTKHWBALJV&url=%2FBROKIG-Lightweight-Jogger-Workout-Sweatpants%2Fdp%2FB08F3JMPCC%2Fref%3Dsr_1_54_sspa%3Fdchild%3D1%26keywords%3Djoggers%26qid%3D1612402325%26sr%3D8-54-spons%26psc%3D1&qualifier=1612402325&id=1789006449721965&widgetName=sp_btf
"G Gradual Women's Sweatpants with Zipper Pockets Cotton Pants Joggers for Women Running, Jogging, Lounge",$27.99,4.5 out of 5 stars,84,https://www.amazon.com//gp/slredirect/picassoRedirect.html/ref=pa_sp_btf_aps_sr_pg1_1?ie=UTF8&adId=A06160489XBIR3Y71QOJ&url=%2FGradual-Sweatpants-Pockets-Joggers-Running%2Fdp%2FB08KP8P1LZ%2Fref%3Dsr_1_55_sspa%3Fdchild%3D1%26keywords%3Djoggers%26qid%3D1612402325%26sr%3D8-55-spons%26psc%3D1&qualifier=1612402325&id=1789006449721965&widgetName=sp_btf
Willit Men's Cotton Yoga Sweatpants Open Bottom Joggers Straight Leg Running Casual Loose Fit Athletic Pants with Pockets,$27.19,4.4 out of 5 stars,222,https://www.amazon.com//gp/slredirect/picassoRedirect.html/ref=pa_sp_btf_aps_sr_pg1_1?ie=UTF8&adId=A0127464GVRKU1HEG7S2&url=%2FWillit-Sweatpants-Joggers-Straight-Athletic%2Fdp%2FB08NX3ZP7S%2Fref%3Dsr_1_56_sspa%3Fdchild%3D1%26keywords%3Djoggers%26qid%3D1612402325%26sr%3D8-56-spons%26psc%3D1&qualifier=1612402325&id=1789006449721965&widgetName=sp_btf
"G Gradual Women's Joggers High Waisted Yoga Pants with Pockets Loose Leggings for Women Workout, Athletic, Lounge",$26.99,4.5 out of 5 stars,98,https://www.amazon.com//gp/slredirect/picassoRedirect.html/ref=pa_sp_btf_aps_sr_pg1_1?ie=UTF8&adId=A07687943EAO9S3T81CEI&url=%2FGradual-Joggers-Waisted-Leggings-Athletic%2Fdp%2FB08LB5LWF1%2Fref%3Dsr_1_57_sspa%3Fdchild%3D1%26keywords%3Djoggers%26qid%3D1612402325%26sr%3D8-57-spons%26psc%3D1&qualifier=1612402325&id=1789006449721965&widgetName=sp_btf
EK Mens Gym Jogger Pants Training Workout Slim fit Sweatpants Causal Leg Zipper,$26.99,4.4 out of 5 stars,829,https://www.amazon.com//gp/slredirect/picassoRedirect.html/ref=pa_sp_btf_aps_sr_pg1_1?ie=UTF8&adId=A079099939NWFYD4TTBKZ&url=%2FEK-Active-Training-Workout-Sweatpants%2Fdp%2FB07JM85NHQ%2Fref%3Dsr_1_58_sspa%3Fdchild%3D1%26keywords%3Djoggers%26qid%3D1612402325%26sr%3D8-58-spons%26psc%3D1%26smid%3DALC3UHQ5V1J0P&qualifier=1612402325&id=1789006449721965&widgetName=sp_btf
BROKIG Mens Zip Joggers Pants - Casual Gym Workout Track Pants Comfortable Slim Fit Tapered Sweatpants with Pockets,$26.99,4.4 out of 5 stars,"4,323",https://www.amazon.com//gp/slredirect/picassoRedirect.html/ref=pa_sp_btf_aps_sr_pg1_1?ie=UTF8&adId=A02395141DIMZPJLJR4V5&url=%2FBROKIG-Mens-Zip-Jogger-Pants%2Fdp%2FB071FJ88QJ%2Fref%3Dsr_1_59_sspa%3Fdchild%3D1%26keywords%3Djoggers%26qid%3D1612402325%26sr%3D8-59-spons%26psc%3D1&qualifier=1612402325&id=1789006449721965&widgetName=sp_btf
"Dragon Fit Joggers for Women with Pockets,High Waist Workout Yoga Tapered Sweatpants Women's Lounge Pants",$23.78,4.4 out of 5 stars,"4,048",https://www.amazon.com//gp/slredirect/picassoRedirect.html/ref=pa_sp_atf_aps_sr_pg1_1?ie=UTF8&adId=A08387411ASO2WJU10V8G&url=%2FDragon-Fit-Joggers-Sweatpants-Joggers78-Black%2Fdp%2FB086L7C9DR%2Fref%3Dsr_1_1_sspa%3Fdchild%3D1%26keywords%3Djoggers%26qid%3D1612402332%26smid%3DA397WKTEFGO1N7%26sr%3D8-1-spons%26psc%3D1&qualifier=1612402332&id=4439843113897770&widgetName=sp_atf
AJISAI Women's Joggers Pants Drawstring Running Sweatpants with Pockets Lounge Wear,$30.98,4.6 out of 5 stars,"1,858",https://www.amazon.com//gp/slredirect/picassoRedirect.html/ref=pa_sp_atf_aps_sr_pg1_1?ie=UTF8&adId=A0264790NSFS1P1KV9Z4&url=%2FAJISAI-Joggers-Drawstring-Running-Sweatpants%2Fdp%2FB08JLJSLTB%2Fref%3Dsr_1_2_sspa%3Fdchild%3D1%26keywords%3Djoggers%26qid%3D1612402332%26sr%3D8-2-spons%26psc%3D1&qualifier=1612402332&id=4439843113897770&widgetName=sp_atf
Leggings Depot Women's Printed Solid Activewear Jogger Track Cuff Sweatpants,$14.99,4.4 out of 5 stars,"48,944",https://www.amazon.com//Leggings-Depot-JGA128-BLACK-SMALL/dp/B07B8V774Y/ref=sr_1_3?dchild=1&keywords=joggers&qid=1612402332&sr=8-3
Southpole Men's Active Basic Jogger Fleece Pants,$14.99,4.4 out of 5 stars,"33,528",https://www.amazon.com//Southpole-Active-Jogger-Heather-Charcoal/dp/B07BRGLGJ7/ref=sr_1_4?dchild=1&keywords=joggers&qid=1612402332&sr=8-4
Oalka Women's Joggers High Waist Yoga Pockets Sweatpants Sport Workout Pants,$22.99,4.5 out of 5 stars,"2,827",https://www.amazon.com//Oalka-Joggers-Pockets-Sweatpants-Workout/dp/B08F7K9FWF/ref=sr_1_5?dchild=1&keywords=joggers&qid=1612402332&sr=8-5
Champion Men's Jogger,$22.50,4.4 out of 5 stars,"7,713",https://www.amazon.com//Champion-Mens-Jersey-Jogger-Black/dp/B073R28JZZ/ref=sr_1_6?dchild=1&keywords=joggers&qid=1612402332&sr=8-6
FULLSOFT Sweatpants for Women-Womens Joggers with Pockets Lounge Pants for Yoga Workout Running,$16.99,4.3 out of 5 stars,247,https://www.amazon.com//FULLSOFT-Sweatpants-Women-Womens-Joggers-Pockets/dp/B08KDB59R2/ref=sr_1_7?dchild=1&keywords=joggers&qid=1612402332&sr=8-7
BALEAF Women's Cotton Sweatpants Leisure Joggers Pants Tapered Active Yoga Lounge Casual Travel Pants with Pockets,$29.99,4.3 out of 5 stars,"11,685",https://www.amazon.com//Baleaf-Womens-Active-Pockets-Charcoal/dp/B072JT9YQP/ref=sr_1_8?dchild=1&keywords=joggers&qid=1612402332&sr=8-8
Hanes Men's Sweatpants,$13.50,4.5 out of 5 stars,"10,382",https://www.amazon.com//Hanes-EcoSmart-Sweatpant-O8389-Charcoal/dp/B07HDLPVLH/ref=sr_1_9?dchild=1&keywords=joggers&qid=1612402332&sr=8-9
"G Gradual Men's Sweatpants with Zipper Pockets Athletic Pants Traning Track Pants Joggers for Men Soccer, Running, Workout",$26.99,4.2 out of 5 stars,51,https://www.amazon.com//Gradual-Sweatpants-Pockets-Athletic-Traning/dp/B08P1NVJDW/ref=sr_1_10?dchild=1&keywords=joggers&qid=1612402332&sr=8-10
Champion Men's Powerblend Retro Fleece Jogger Pant,$29.98,4.7 out of 5 stars,"13,746",https://www.amazon.com//Champion-Powerblend-Fleece-Jogger-Medium/dp/B01H7HOR5W/ref=sr_1_11?dchild=1&keywords=joggers&qid=1612402332&sr=8-11
LA12ST Women's Juniors Soft Jogger Pants Drawstring Pockets,$13.99,4.2 out of 5 stars,"15,124",https://www.amazon.com//LA12ST-Womens-Juniors-Drawstring-Pockets/dp/B07GGM24ZF/ref=sr_1_12?dchild=1&keywords=joggers&qid=1612402332&sr=8-12
Hanes Women's Jogger with Pockets,$16.00,4.5 out of 5 stars,893,https://www.amazon.com//Hanes-Womens-Jogger-Pockets-Heather/dp/B07P5HFRY5/ref=sr_1_13?dchild=1&keywords=joggers&qid=1612402332&sr=8-13
Colorfulkoala Women's High Waisted Fitted Joggers,$34.99,4.5 out of 5 stars,"5,511",https://www.amazon.com//Colorfulkoala-Colorfulkoala-Womens-High-Waisted-Fitted-Joggers-S-Black/dp/B07ZF9YX2J/ref=sr_1_14?dchild=1&keywords=joggers&qid=1612402332&sr=8-14
Amazon Essentials Women's Studio Terry Relaxed-Fit Jogger Pant,$20.95,4.5 out of 5 stars,"3,359",https://www.amazon.com//Amazon-Essentials-Womens-Studio-Heather/dp/B07JP5STRM/ref=sr_1_15?dchild=1&keywords=joggers&qid=1612402332&sr=8-15
STELLE Women's Cotton Sweatpants Yoga Joggers Athletic Workout Track Pants with Pockets,$18.99,4.5 out of 5 stars,479,https://www.amazon.com//STELLE-Sweatpants-Joggers-Athletic-Workout/dp/B08F5CNSRK/ref=sr_1_16?dchild=1&keywords=joggers&qid=1612402332&sr=8-16
Southpole Men's Basic Fleece Jogger Pant-Reg and Big & Tall Sizes,$16.99,4.5 out of 5 stars,"10,906",https://www.amazon.com//Southpole-Fleece-Marled-Jogger-Medium/dp/B0714LXXPR/ref=sr_1_17?dchild=1&keywords=joggers&qid=1612402332&sr=8-17
"Dragon Fit Joggers for Women with Pockets,High Waist Workout Yoga Tapered Sweatpants Women's Lounge Pants",$23.78,4.4 out of 5 stars,"4,048",https://www.amazon.com//Dragon-Fit-Joggers-Sweatpants-Joggers78-Black/dp/B086L7C9DR/ref=sr_1_18_mod_primary_lightning_deal?dchild=1&keywords=joggers&qid=1612402332&sbo=Tc8eqSFhUl4VwMzbE4fw%2Fw%3D%3D&smid=A397WKTEFGO1N7&sr=8-18
AJISAI Women's Joggers Pants Drawstring Running Sweatpants with Pockets Lounge Wear,$29.99,4.6 out of 5 stars,"1,858",https://www.amazon.com//AJISAI-Joggers-Drawstring-Running-Sweatpants/dp/B07W5V3FX6/ref=sr_1_19?dchild=1&keywords=joggers&qid=1612402332&sr=8-19
Amazon Essentials Women's Relaxed Fit French Terry Fleece Jogger Sweatpant,$21.00,4.4 out of 5 stars,"12,055",https://www.amazon.com//Amazon-Essentials-Womens-French-Sweatpant/dp/B07BJ8F5VP/ref=sr_1_20?dchild=1&keywords=joggers&qid=1612402332&sr=8-20
CRZ YOGA Women's Lightweight Joggers Pants with Pockets Drawstring Workout Running Pants with Elastic Waist,$30.00,4.3 out of 5 stars,"5,911",https://www.amazon.com//CRZ-YOGA-Womens-Drawstring-Training/dp/B07G57FWM7/ref=sr_1_21?dchild=1&keywords=joggers&qid=1612402332&sr=8-21
Southpole Junior's Fleece Basic Jogger,$12.99,3.9 out of 5 stars,"4,176",https://www.amazon.com//Southpole-Juniors-Fleece-Basic-Jogger/dp/B07TZ5CVDV/ref=sr_1_22?dchild=1&keywords=joggers&qid=1612402332&sr=8-22
GOKATOSAU Women's Sexy Lounge Stretch Casual Jogger Drawstring Sweatpants with Pockets,$26.99,4.4 out of 5 stars,847,https://www.amazon.com//GOKATOSAU-Stretch-Drawstring-Sweatpants-Pockets/dp/B08D969JHB/ref=sr_1_23?dchild=1&keywords=joggers&qid=1612402332&sr=8-23
BROKIG Mens Zip Joggers Pants - Casual Gym Workout Track Pants Comfortable Slim Fit Tapered Sweatpants with Pockets,$26.99,4.4 out of 5 stars,"4,323",https://www.amazon.com//BROKIG-Mens-Zip-Jogger-Pants/dp/B071FJ88QJ/ref=sr_1_24?dchild=1&keywords=joggers&qid=1612402332&sr=8-24
Hanes Women's Jogger,$16.00,4.4 out of 5 stars,784,https://www.amazon.com//Hanes-Womens-Pockets-Juniper-Heather/dp/B07P6DNSJN/ref=sr_1_25?dchild=1&keywords=joggers&qid=1612402332&sr=8-25
"Rrosseyz Womens Joggers with Pockets, Sweatpants for Women Loose fit Pants for Yoga Running Casual",$20.99,4.7 out of 5 stars,26,https://www.amazon.com//Rrosseyz-Joggers-Pockets-Sweatpants-Running/dp/B08P9H7G2Z/ref=sr_1_26?dchild=1&keywords=joggers&qid=1612402332&sr=8-26
Ouber Men's Gym Jogger Pants Slim Fit Workout Running Sweatpants with Zipper Pockets,$24.99,4.2 out of 5 stars,"5,312",https://www.amazon.com//gp/slredirect/picassoRedirect.html/ref=pa_sp_mtf_aps_sr_pg1_1?ie=UTF8&adId=A071669926848YK7FH4GP&url=%2FOuber-Workout-Running-Sweatpants-Pockets%2Fdp%2FB07D7W798H%2Fref%3Dsr_1_27_sspa%3Fdchild%3D1%26keywords%3Djoggers%26qid%3D1612402332%26sr%3D8-27-spons%26psc%3D1&qualifier=1612402332&id=4439843113897770&widgetName=sp_mtf
"G Gradual Women's Sweatpants with Zipper Pockets Cotton Pants Joggers for Women Running, Jogging, Lounge",$27.99,4.5 out of 5 stars,84,https://www.amazon.com//gp/slredirect/picassoRedirect.html/ref=pa_sp_mtf_aps_sr_pg1_1?ie=UTF8&adId=A06221121W629I52S37PX&url=%2FGradual-Sweatpants-Pockets-Joggers-Tidewater%2Fdp%2FB08KP89V5N%2Fref%3Dsr_1_28_sspa%3Fdchild%3D1%26keywords%3Djoggers%26qid%3D1612402332%26sr%3D8-28-spons%26psc%3D1&qualifier=1612402332&id=4439843113897770&widgetName=sp_mtf
"Men's Casual Joggers Pant,Slim Fit Athletic Sweatpants for Gym Workout Athletic with Zipper Ankle Cuffs",$24.99,4.6 out of 5 stars,174,https://www.amazon.com//gp/slredirect/picassoRedirect.html/ref=pa_sp_mtf_aps_sr_pg1_1?ie=UTF8&adId=A03747604YB6AD4ZF5BV&url=%2FCasual-Joggers-Athletic-Sweatpants-Workout%2Fdp%2FB08HTZJL9B%2Fref%3Dsr_1_29_sspa%3Fdchild%3D1%26keywords%3Djoggers%26qid%3D1612402332%26sr%3D8-29-spons%26psc%3D1&qualifier=1612402332&id=4439843113897770&widgetName=sp_mtf
"BROKIG Mens Lightweight Gym Jogger Pants,Men's Workout Sweatpants with Zip Pocket",$26.38,4.5 out of 5 stars,587,https://www.amazon.com//BROKIG-Lightweight-Jogger-Workout-Sweatpants/dp/B08F3JMPCC/ref=sr_1_30?dchild=1&keywords=joggers&qid=1612402332&sr=8-30
Amazon Essentials Women's Relaxed-Fit Studio Terry Capri Jogger Pant,$21.70,4.5 out of 5 stars,"1,929",https://www.amazon.com//Amazon-Essentials-Womens-Charcoal-Heather/dp/B07JN6Q1V2/ref=sr_1_31?dchild=1&keywords=joggers&qid=1612402332&sr=8-31
Hanes Sport Women's Performance Fleece Jogger Pants with Pockets,$16.82,4.1 out of 5 stars,"3,380",https://www.amazon.com//Hanes-Womens-Performance-Pockets-Heather/dp/B01L9J9ZYM/ref=sr_1_32?dchild=1&keywords=joggers&qid=1612402332&sr=8-32
NOAHELLA Womens Yoga Sweatpants with Pockets Drawstring Workout Joggers Lounge Pants Casual Athletic Running Pants,$19.99,4.6 out of 5 stars,121,https://www.amazon.com//NOAHELLA-Sweatpants-Drawstring-Athletic-Gray/dp/B08L8ZLK9Z/ref=sr_1_33?dchild=1&keywords=joggers&qid=1612402332&sr=8-33
DIBAOLONG Womens Yoga Sweatpants Loose Workout Joggers Pants Comfy Lounge Pants with Pockets,$21.99,4.3 out of 5 stars,"4,364",https://www.amazon.com//DIBAOLONG-Workout-Running-Joggers-Sweatpants/dp/B07YHHT58F/ref=sr_1_34?dchild=1&keywords=joggers&qid=1612402332&sr=8-34
Champion Women's Jogger,$19.87,4.6 out of 5 stars,"5,740",https://www.amazon.com//Champion-Womens-Powerblend-Granite-Heather/dp/B07KKTG2JB/ref=sr_1_35?dchild=1&keywords=joggers&qid=1612402332&sr=8-35
Southpole Men's Basic Stretch Twill Jogger Pants-Reg and Big & Tall Sizes,$21.99,4.4 out of 5 stars,"4,373",https://www.amazon.com//Southpole-Basic-Stretch-Jogger-Medium/dp/B01N39OH6N/ref=sr_1_36?dchild=1&keywords=joggers&qid=1612402332&sr=8-36
Amazon Essentials Men's Jogger,$17.00,4.6 out of 5 stars,"11,194",https://www.amazon.com//Amazon-Essentials-Standard-Fleece-Jogger/dp/B07P7KYGX6/ref=sr_1_37?dchild=1&keywords=joggers&qid=1612402332&sr=8-37
LEINIDINA Women’s Jogger Pants High Waisted Sweatpants with Pockets Tapered Casual Lounge Pants Loose Track Cuff Leggings,$23.99,4.5 out of 5 stars,706,https://www.amazon.com//LEINIDINA-Waisted-Sweatpants-Pockets-Leggings/dp/B08GHMCD38/ref=sr_1_38?dchild=1&keywords=joggers&qid=1612402332&sr=8-38
WT02 Men's Jogger,$17.41,4.4 out of 5 stars,"6,145",https://www.amazon.com//WT02-Basic-Jogger-Fleece-Medium/dp/B07BS4LZFP/ref=sr_1_39?dchild=1&keywords=joggers&qid=1612402332&sr=8-39
Soothfeel Women’s Joggers with Phone Pockets High Waist Athletic Workout Yoga Tapered Lounge Pants Joggers for Women,$26.99,4.5 out of 5 stars,75,https://www.amazon.com//Soothfeel-Joggers-Pockets-Athletic-Workout/dp/B08LKRRM6G/ref=sr_1_40?dchild=1&keywords=joggers&qid=1612402332&sr=8-40
Under Armour Men's Sportstyle Tricot Joggers,$39.99,4.7 out of 5 stars,"5,009",https://www.amazon.com//Under-Armour-Sportstyle-Jogger-Heather/dp/B01MEHHVTO/ref=sr_1_41?dchild=1&keywords=joggers&qid=1612402332&sr=8-41
Women's Cinch Bottom Sweatpants Pockets High Waist Sporty Gym Athletic Fit Jogger Pants Lounge Trousers,$25.99,4.0 out of 5 stars,"5,321",https://www.amazon.com//Womens-Sweatpants-Pockets-Athletic-Trousers/dp/B0874GK7Q7/ref=sr_1_42?dchild=1&keywords=joggers&qid=1612402332&sr=8-42
Goodthreads Men's Jogger,$25.00,4.2 out of 5 stars,"1,716",https://www.amazon.com//Goodthreads-Mens-Fleece-Jogger-Medium/dp/B07L32RYLD/ref=sr_1_43?dchild=1&keywords=joggers&qid=1612402332&sr=8-43
czzstance Men's Sweatpants Cotton Jogger Pants with Pockets Casual Loose Fit Athletic Drawstring Training Pants,$29.99,4.6 out of 5 stars,522,https://www.amazon.com//czzstance-Sweatpants-Athletic-Drawstring-Training/dp/B08GYZZKFC/ref=sr_1_44?dchild=1&keywords=joggers&qid=1612402332&sr=8-44
Southpole Big Boys' Jogger Fleece Pants in Basic Colors,$14.41,4.6 out of 5 stars,"4,502",https://www.amazon.com//Southpole-Jogger-Fleece-Colors-Marled/dp/B06XS4C9FF/ref=sr_1_45?dchild=1&keywords=joggers&qid=1612402332&sr=8-45
Champion Women's Powerblend Jogger,$29.00,4.5 out of 5 stars,664,https://www.amazon.com//Champion-Womens-Powerblend-Jogger-Black-GF937/dp/B07MTHYMJQ/ref=sr_1_46?dchild=1&keywords=joggers&qid=1612402332&sr=8-46
"PHISOCKAT Women's Joggers Pants High Waist Athletic Joggers with Pockets Tapered Lounge Pants for Workout, Running, Yoga",$21.95,4.8 out of 5 stars,40,https://www.amazon.com//PHISOCKAT-Joggers-Athletic-Pockets-Tapered/dp/B08QTZKXMN/ref=sr_1_47?dchild=1&keywords=joggers&qid=1612402332&sr=8-47
adidas Men's Tiro 19 Training Pants,$35.00,4.7 out of 5 stars,"23,147",https://www.amazon.com//adidas-Tiro19-Training-Pants-Black/dp/B07CNBLX7G/ref=sr_1_48?dchild=1&keywords=joggers&qid=1612402332&sr=8-48
Champion Boys Sweatpant Heritage Collection Slim Fit Brushed Fleece Big and Little Boys Kids,$34.99,4.4 out of 5 stars,"4,577",https://www.amazon.com//Champion-Sweatpant-Heritage-Collection-Brushed/dp/B07SZ38S4Q/ref=sr_1_49?dchild=1&keywords=joggers&qid=1612402332&sr=8-49
Champion Men's Powerblend Graphic Jogger,$24.00,4.7 out of 5 stars,933,https://www.amazon.com//Champion-Powerblend-Graphic-Jogger-549314/dp/B07SZMLJRJ/ref=sr_1_50?dchild=1&keywords=joggers&qid=1612402332&sr=8-50
Nike Club Men's Training Joggers,$53.38,5.0 out of 5 stars,4,https://www.amazon.com//Nike-Training-Joggers-Dorado-Large/dp/B08PP5H2CW/ref=sr_1_51?dchild=1&keywords=joggers&qid=1612402332&sr=8-51
Champion Women's Jersey Pocket Pant,$15.38,4.2 out of 5 stars,"7,143",https://www.amazon.com//Champion-Womens-Jersey-Pocket-Black/dp/B011B7CS6Y/ref=sr_1_52?dchild=1&keywords=joggers&qid=1612402332&sr=8-52
DIBAOLONG Womens Yoga Sweatpants Loose Workout Harem Joggers Casual Comfy Lounge Pajama Pants with Pockets,$23.99,4.5 out of 5 stars,58,https://www.amazon.com//DIBAOLONG-Sweatpants-Workout-Joggers-Pockets/dp/B08P4QJ1TN/ref=sr_1_53?dchild=1&keywords=joggers&qid=1612402332&sr=8-53
Ouber Men's Cargo Joggers Gym Pants with Zippered Pockets,$30.99,4.3 out of 5 stars,231,https://www.amazon.com//gp/slredirect/picassoRedirect.html/ref=pa_sp_btf_aps_sr_pg1_1?ie=UTF8&adId=A10337061RTN70CGZV148&url=%2FOuber-Joggers-Pants-Zippered-Pockets%2Fdp%2FB07D8RCBPN%2Fref%3Dsr_1_54_sspa%3Fdchild%3D1%26keywords%3Djoggers%26qid%3D1612402332%26sr%3D8-54-spons%26psc%3D1&qualifier=1612402332&id=4439843113897770&widgetName=sp_btf
"BROKIG Mens Lightweight Gym Jogger Pants,Men's Workout Sweatpants with Zip Pocket",$26.38,4.5 out of 5 stars,587,https://www.amazon.com//gp/slredirect/picassoRedirect.html/ref=pa_sp_btf_aps_sr_pg1_1?ie=UTF8&adId=A01758833HAFTKHWBALJV&url=%2FBROKIG-Lightweight-Jogger-Workout-Sweatpants%2Fdp%2FB08F3JMPCC%2Fref%3Dsr_1_55_sspa%3Fdchild%3D1%26keywords%3Djoggers%26qid%3D1612402332%26sr%3D8-55-spons%26psc%3D1&qualifier=1612402332&id=4439843113897770&widgetName=sp_btf
Willit Men's Cotton Yoga Sweatpants Open Bottom Joggers Straight Leg Running Casual Loose Fit Athletic Pants with Pockets,$27.19,4.4 out of 5 stars,222,https://www.amazon.com//gp/slredirect/picassoRedirect.html/ref=pa_sp_btf_aps_sr_pg1_1?ie=UTF8&adId=A012730824WG1R1TAH9LT&url=%2FWillit-Sweatpants-Joggers-Straight-Athletic%2Fdp%2FB08NX4HRP6%2Fref%3Dsr_1_56_sspa%3Fdchild%3D1%26keywords%3Djoggers%26qid%3D1612402332%26sr%3D8-56-spons%26psc%3D1&qualifier=1612402332&id=4439843113897770&widgetName=sp_btf
"G Gradual Women's Joggers High Waisted Yoga Pants with Pockets Loose Leggings for Women Workout, Athletic, Lounge",$26.99,4.5 out of 5 stars,98,https://www.amazon.com//gp/slredirect/picassoRedirect.html/ref=pa_sp_btf_aps_sr_pg1_1?ie=UTF8&adId=A07687943EAO9S3T81CEI&url=%2FGradual-Joggers-Waisted-Leggings-Athletic%2Fdp%2FB08LB5LWF1%2Fref%3Dsr_1_57_sspa%3Fdchild%3D1%26keywords%3Djoggers%26qid%3D1612402332%26sr%3D8-57-spons%26psc%3D1&qualifier=1612402332&id=4439843113897770&widgetName=sp_btf
EK Mens Gym Jogger Pants Training Workout Slim fit Sweatpants Causal Leg Zipper,$26.99,4.4 out of 5 stars,829,https://www.amazon.com//gp/slredirect/picassoRedirect.html/ref=pa_sp_btf_aps_sr_pg1_1?ie=UTF8&adId=A079099939NWFYD4TTBKZ&url=%2FEK-Active-Training-Workout-Sweatpants%2Fdp%2FB07JM85NHQ%2Fref%3Dsr_1_58_sspa%3Fdchild%3D1%26keywords%3Djoggers%26qid%3D1612402332%26sr%3D8-58-spons%26psc%3D1%26smid%3DALC3UHQ5V1J0P&qualifier=1612402332&id=4439843113897770&widgetName=sp_btf
BROKIG Mens Zip Joggers Pants - Casual Gym Workout Track Pants Comfortable Slim Fit Tapered Sweatpants with Pockets,$26.99,4.4 out of 5 stars,"4,323",https://www.amazon.com//gp/slredirect/picassoRedirect.html/ref=pa_sp_btf_aps_sr_pg1_1?ie=UTF8&adId=A02395141DIMZPJLJR4V5&url=%2FBROKIG-Mens-Zip-Jogger-Pants%2Fdp%2FB071FJ88QJ%2Fref%3Dsr_1_59_sspa%3Fdchild%3D1%26keywords%3Djoggers%26qid%3D1612402332%26sr%3D8-59-spons%26psc%3D1&qualifier=1612402332&id=4439843113897770&widgetName=sp_btf
"Dragon Fit Joggers for Women with Pockets,High Waist Workout Yoga Tapered Sweatpants Women's Lounge Pants",$23.78,4.4 out of 5 stars,"4,048",https://www.amazon.com//gp/slredirect/picassoRedirect.html/ref=pa_sp_atf_aps_sr_pg1_1?ie=UTF8&adId=A08387411ASO2WJU10V8G&url=%2FDragon-Fit-Joggers-Sweatpants-Joggers78-Black%2Fdp%2FB086L7C9DR%2Fref%3Dsr_1_1_sspa%3Fdchild%3D1%26keywords%3Djoggers%26qid%3D1612402336%26smid%3DA397WKTEFGO1N7%26sr%3D8-1-spons%26psc%3D1&qualifier=1612402336&id=7252222915482797&widgetName=sp_atf
AJISAI Women's Joggers Pants Drawstring Running Sweatpants with Pockets Lounge Wear,$30.98,4.6 out of 5 stars,"1,858",https://www.amazon.com//gp/slredirect/picassoRedirect.html/ref=pa_sp_atf_aps_sr_pg1_1?ie=UTF8&adId=A0264790NSFS1P1KV9Z4&url=%2FAJISAI-Joggers-Drawstring-Running-Sweatpants%2Fdp%2FB08JLJSLTB%2Fref%3Dsr_1_2_sspa%3Fdchild%3D1%26keywords%3Djoggers%26qid%3D1612402336%26sr%3D8-2-spons%26psc%3D1&qualifier=1612402336&id=7252222915482797&widgetName=sp_atf
