Description,Price,Ratings,Review Count,Url
Century Star Womens Fuzzy Hoodies Pullover Cozy Oversized Pockets Hooded Sweatshirt Athletic Fleece Hoodies,$26.99,4.3 out of 5 stars,"3,289",https://www.amazon.com//Century-Star-Pullover-Oversized-Sweatshirt/dp/B08G4VG11F/ref=sr_1_34?dchild=1&keywords=sweatshirt&qid=1612402964&sr=8-34
Champion Men's Graphic Powerblend Fleece Hoodie,$33.73,4.8 out of 5 stars,"17,617",https://www.amazon.com//Champion-Graphic-Powerblend-Granite-Heather/dp/B078H7ZLQG/ref=sr_1_35?dchild=1&keywords=sweatshirt&qid=1612402964&sr=8-35
Hanes Women's EcoSmart Full-Zip Hoodie Sweatshirt,$11.27,4.5 out of 5 stars,"1,543",https://www.amazon.com//Hanes-Womens-Full-Zip-Splendor-Heather/dp/B07TQNFJ62/ref=sr_1_36?dchild=1&keywords=sweatshirt&qid=1612402964&sr=8-36
Under Armour Men's Armour Fleece Big Logo Hoodie,$37.18,4.8 out of 5 stars,"1,990",https://www.amazon.com//Under-Armour-Fleece-Academy-X-Large/dp/B07YXLQNBK/ref=sr_1_37?dchild=1&keywords=sweatshirt&qid=1612402964&sr=8-37
Champion Women's Powerblend Boyfriend Crew Sweatshirt,$22.89,4.5 out of 5 stars,"2,524",https://www.amazon.com//Champion-Powerblend-Boyfriend-Sweatshirt-Venetian/dp/B07S2SFXWP/ref=sr_1_38?dchild=1&keywords=sweatshirt&qid=1612402964&sr=8-38
PINKMSTYLE Women's Casual Color Block Hoodies Tops Long Sleeve Drawstring Pullover Sweatshirts with Pocket(S-XXL),$21.23,4.6 out of 5 stars,"2,278",https://www.amazon.com//Drawstring-Sweatshirts-Kangaroo-Lightweight-Pullover/dp/B08KQF51LF/ref=sr_1_39_mod_primary_lightning_deal?dchild=1&keywords=sweatshirt&qid=1612402964&sbo=Tc8eqSFhUl4VwMzbE4fw%2Fw%3D%3D&smid=A346U59ZZR17GM&sr=8-39
Yanekop Womens Love Letter Printed Off Shoulder Pullover Sweatshirt Slouchy Tops Shirts,$20.99,4.6 out of 5 stars,"4,220",https://www.amazon.com//Yanekop-Printed-Shoulder-Pullover-Sweatshirt/dp/B07VRMNLVB/ref=sr_1_40?dchild=1&keywords=sweatshirt&qid=1612402964&sr=8-40
"Gildan Women's Fleece Crewneck Sweatshirt, Style G18000fl",$9.86,4.5 out of 5 stars,"3,346",https://www.amazon.com//Gildan-Crewneck-Sweatshirt-Aubergine-X-Large/dp/B076C3VQ5Q/ref=sr_1_41?dchild=1&keywords=sweatshirt&qid=1612402964&sr=8-41
Yanekop Womens Solid Loose Crewneck Sweatshirt Casual Long Sleeve Pullover Tops Shirt,$19.99,3.7 out of 5 stars,65,https://www.amazon.com//Yanekop-Womens-Crewneck-Sweatshirt-Pullover/dp/B08QD38VC8/ref=sr_1_42?dchild=1&keywords=sweatshirt&qid=1612402964&sr=8-42
XUERRY Womens Casual V-NECK Long Sleeves Pocket Solid Color Sweatshirt Tunics Blouse Tops,$17.84,4.1 out of 5 stars,"2,899",https://www.amazon.com//XUERRY-Womens-Casual-Sleeves-Sweatshirt/dp/B07L252HT1/ref=sr_1_44?dchild=1&keywords=sweatshirt&qid=1612402964&sr=8-44
Champion Men's Powerblend Applique Crew,$25.26,4.7 out of 5 stars,813,https://www.amazon.com//Champion-Powerblend-Script-Applique-Medium/dp/B081KMJL7S/ref=sr_1_45?dchild=1&keywords=sweatshirt&qid=1612402964&sr=8-45
Hanes Women's French Terry Full-Zip Hoodie Sweatshirt,$14.10,4.5 out of 5 stars,"8,448",https://www.amazon.com//Hanes-Womens-French-Full-Zip-Hoodie/dp/B01I94LOYE/ref=sr_1_46?dchild=1&keywords=sweatshirt&qid=1612402964&sr=8-46
Amazon Brand - Core 10 Women's Cloud Soft Cropped Flow V-Neck Relaxed Fit Yoga Sweatshirt,$31.10,4.6 out of 5 stars,22,https://www.amazon.com//Amazon-Brand-Cropped-Relaxed-Sweatshirt/dp/B08647ZSYR/ref=sr_1_47?dchild=1&keywords=sweatshirt&qid=1612402964&sr=8-47
Under Armour Men's Rival Fleece Hoodie,$26.99,4.8 out of 5 stars,"1,668",https://www.amazon.com//Under-Armour-Fleece-Academy-X-Large/dp/B07YXN8Q59/ref=sr_1_48?dchild=1&keywords=sweatshirt&qid=1612402964&sr=8-48
Champion Men's Graphic Powerblend Fleece Pullover Hood,$37.49,4.7 out of 5 stars,"5,739",https://www.amazon.com//Champion-Graphic-Powerblend-Fleece-Pullover/dp/B07DGRNZ1W/ref=sr_1_49?dchild=1&keywords=sweatshirt&qid=1612402964&sr=8-49
American Trends Oversized Sweatshirts for Women Athletic Womens Sherpa Hoodie Fluffy Women's Hoodies Pullover with Pockets,$26.99,4.3 out of 5 stars,964,https://www.amazon.com//American-Trends-Sweatshirts-Athletic-Pullover/dp/B08PB9JCR9/ref=sr_1_50?dchild=1&keywords=sweatshirt&qid=1612402964&sr=8-50
Amazon Essentials Women's Classic Fit Lightweight Long-Sleeve V-Neck Sweater,$23.00,4.5 out of 5 stars,"8,033",https://www.amazon.com//Amazon-Essentials-Standard-Lightweight-Sweater/dp/B07QHG3N59/ref=sr_1_51?dchild=1&keywords=sweatshirt&qid=1612402964&sr=8-51
THE SCOTTS Men Crewneck Sweatshirt Kanye I Am Loving Awareness Sweatshirt Vintage Graphic Hip Hop Sweatshirt Hoodie,$37.99,4.6 out of 5 stars,26,https://www.amazon.com//SCOTTS-Crewneck-Sweatshirt-Awareness-Vintage/dp/B08JSMNCRD/ref=sr_1_52?dchild=1&keywords=sweatshirt&qid=1612402964&sr=8-52
Champion Men's Powerblend Graphic Crew,$26.65,4.4 out of 5 stars,421,https://www.amazon.com//Champion-Mens-Powerblend-Graphic-Courageous/dp/B081KQ2ZDT/ref=sr_1_54?dchild=1&keywords=sweatshirt&qid=1612402964&sr=8-54
Amazon Essentials Men's Long-Sleeve Lightweight French Terry Crewneck Sweatshirt,$20.00,4.5 out of 5 stars,866,https://www.amazon.com//Amazon-Essentials-Lightweight-Crewneck-Sweatshirt/dp/B07VTQ6RH6/ref=sr_1_55?dchild=1&keywords=sweatshirt&qid=1612402964&sr=8-55
KIRUNDO 2021 Women’s Tie Dye Sporty Sweatshirt Crew Neck Long Sleeves Pullover Ribbed Cuffs Hems Sweaters Outwear,$28.99,4.0 out of 5 stars,"1,839",https://www.amazon.com//KIRUNDO-Sweatshirt-Pullover-Sweaters-Split-Light/dp/B08DCTN62F/ref=sr_1_56?dchild=1&keywords=sweatshirt&qid=1612402964&sr=8-56
Painted Heart Women's Open Back Crew Neck Sweatshirt,$12.99,4.8 out of 5 stars,10,https://www.amazon.com//gp/slredirect/picassoRedirect.html/ref=pa_sp_btf_aps_sr_pg1_1?ie=UTF8&adId=A0599753391K7T8VUX3DS&url=%2FPainted-Heart-Sweatshirt-X-Large-Heather%2Fdp%2FB07GT2FWK8%2Fref%3Dsr_1_57_sspa%3Fdchild%3D1%26keywords%3Dsweatshirt%26qid%3D1612402964%26sr%3D8-57-spons%26psc%3D1&qualifier=1612402964&id=5659429009438955&widgetName=sp_btf
CQC Women's Long Sleeve Fleece Sweatshirt Workout Running Casual Crew Neck Pullover Tops,$23.99,4.3 out of 5 stars,41,https://www.amazon.com//gp/slredirect/picassoRedirect.html/ref=pa_sp_btf_aps_sr_pg1_1?ie=UTF8&adId=A0427955480QQ7BYJ0RL&url=%2FCQC-Sweatshirt-Workout-Running-Pullover%2Fdp%2FB08DHFZ5BK%2Fref%3Dsr_1_58_sspa%3Fdchild%3D1%26keywords%3Dsweatshirt%26qid%3D1612402964%26sr%3D8-58-spons%26psc%3D1&qualifier=1612402964&id=5659429009438955&widgetName=sp_btf
NGOZI Womens Crew Neck Raglan Sleeve Shirt Slouchy Pullover Sweatshirts with Pockets 1X-4X,$12.99,2.6 out of 5 stars,19,https://www.amazon.com//gp/slredirect/picassoRedirect.html/ref=pa_sp_btf_aps_sr_pg1_1?ie=UTF8&adId=A095175334KDM2YL43F57&url=%2FNGOZI-Slouchy-Pullover-Sweatshirts-Pockets%2Fdp%2FB08FKWLVL8%2Fref%3Dsr_1_59_sspa%3Fdchild%3D1%26keywords%3Dsweatshirt%26qid%3D1612402964%26sr%3D8-59-spons%26psc%3D1&qualifier=1612402964&id=5659429009438955&widgetName=sp_btf
Adult Soft and Cozy Crewneck Sweatshirts in 28 Colors in Sizes S-4XL,$23.99,4.5 out of 5 stars,"1,377",https://www.amazon.com//gp/slredirect/picassoRedirect.html/ref=pa_sp_btf_aps_sr_pg1_1?ie=UTF8&adId=A02215411M1WJC3N63XOD&url=%2FJoes-USA-Classic-Crewneck-Sweatshirt%2Fdp%2FB00ML71HVG%2Fref%3Dsr_1_60_sspa%3Fdchild%3D1%26keywords%3Dsweatshirt%26qid%3D1612402964%26sr%3D8-60-spons%26psc%3D1%26smid%3DA2ROZC5KOIO6QV&qualifier=1612402964&id=5659429009438955&widgetName=sp_btf
Hanes Men's Ecosmart Fleece Sweatshirt,$11.00,4.6 out of 5 stars,"71,658",https://www.amazon.com//Hanes-Ecosmart-Fleece-Sweatshirt-Black/dp/B01L8JJ57U/ref=sr_1_1?dchild=1&keywords=sweatshirt&qid=1612402967&sr=8-1
Hanes Mens Pullover Ecosmart Fleece Hooded Sweatshirt,$14.50,4.6 out of 5 stars,"78,325",https://www.amazon.com//Hanes-Pullover-Ecosmart-Sweatshirt-Charcoal/dp/B01L8JJY08/ref=sr_1_2?dchild=1&keywords=sweatshirt&qid=1612402967&sr=8-2
"Gildan Men's Fleece Crewneck Sweatshirt, Style G18000",$15.00,4.7 out of 5 stars,"29,110",https://www.amazon.com//Gildan-Fleece-Crewneck-Sweatshirt-White/dp/B07M61KLP3/ref=sr_1_3?dchild=1&keywords=sweatshirt&qid=1612402967&sr=8-3
Hanes Men's Comfortwash Garment Dyed Fleece Sweatshirt,$14.56,4.7 out of 5 stars,"6,965",https://www.amazon.com//Hanes-ComfortWash-Garment-Sweatshirt-Cypress/dp/B07JYRDQ7Q/ref=sr_1_4?dchild=1&keywords=sweatshirt&qid=1612402967&sr=8-4
Bingerlily Women's Casual Hoodies Long Sleeve Solid Lightweight Pullover Tops Loose Sweatshirt with Pocket,$22.97,4.3 out of 5 stars,"1,467",https://www.amazon.com//Bingerlily-Hoodies-Lightweight-Pullover-Sweatshirt/dp/B08JHXX4SF/ref=sr_1_7?dchild=1&keywords=sweatshirt&qid=1612402967&sr=8-7
"Gildan Men's Fleece Hooded Sweatshirt, Style G18500",$14.50,4.6 out of 5 stars,"50,503",https://www.amazon.com//Gildan-Fleece-Sweatshirt-G18500-Heather/dp/B014RQ1LA0/ref=sr_1_8?dchild=1&keywords=sweatshirt&qid=1612402967&sr=8-8
Champion Men's Powerblend Fleece Pullover Hoodie,$23.15,4.7 out of 5 stars,"26,502",https://www.amazon.com//Champion-Powerblend-Pullover-Granite-Heather/dp/B01HIUTE1K/ref=sr_1_10?dchild=1&keywords=sweatshirt&qid=1612402967&sr=8-10
Amazon Essentials Men's Fleece Crewneck Sweatshirt,$15.00,4.6 out of 5 stars,"12,719",https://www.amazon.com//Amazon-Essentials-Crewneck-Fleece-Sweatshirt/dp/B07BN3XSHD/ref=sr_1_11?dchild=1&keywords=sweatshirt&qid=1612402967&sr=8-11
Hanes Men's Ultimate Cotton Heavyweight Crewneck Sweatshirt,$15.37,4.5 out of 5 stars,"11,571",https://www.amazon.com//Hanes-Ultimate-Heavyweight-Sweatshirt-X-Large/dp/B00JUMCTRQ/ref=sr_1_12?dchild=1&keywords=sweatshirt&qid=1612402967&sr=8-12
Amazon Essentials Men's Long-Sleeve Lightweight French Terry Crewneck Sweatshirt,$20.00,4.5 out of 5 stars,866,https://www.amazon.com//gp/slredirect/picassoRedirect.html/ref=pa_sp_mtf_aps_sr_pg1_1?ie=UTF8&adId=A09339433OCEIHO6J1P3L&url=%2FAmazon-Essentials-Lightweight-Crewneck-Sweatshirt%2Fdp%2FB07VTQ6RH6%2Fref%3Dsr_1_13_sspa%3Fdchild%3D1%26keywords%3Dsweatshirt%26qid%3D1612402967%26sr%3D8-13-spons%26psc%3D1&qualifier=1612402967&id=7590149187803550&widgetName=sp_mtf
Women’s Crewneck Sweatshirt Long Sleeve Pullover Tops,$26.99, , ,https://www.amazon.com//gp/slredirect/picassoRedirect.html/ref=pa_sp_mtf_aps_sr_pg1_1?ie=UTF8&adId=A08803392LFOL6BY6PG8U&url=%2FWomens-Velvety-Sweatshirt-Sleeve-Pullover%2Fdp%2FB08MW7GTSG%2Fref%3Dsr_1_14_sspa%3Fdchild%3D1%26keywords%3Dsweatshirt%26qid%3D1612402967%26sr%3D8-14-spons%26psc%3D1&qualifier=1612402967&id=7590149187803550&widgetName=sp_mtf
YSYOKOW Womens Casual Loose T Shirts Short/Long Sleeve Blouses Tunic Tops with Pockets,$21.99,4.5 out of 5 stars,"2,944",https://www.amazon.com//gp/slredirect/picassoRedirect.html/ref=pa_sp_mtf_aps_sr_pg1_1?ie=UTF8&adId=A01526731YTHH3BPW02SD&url=%2FYSYOKOW-Womens-Blouses-Pockets-X-Large%2Fdp%2FB08HZ2TB41%2Fref%3Dsr_1_15_sspa%3Fdchild%3D1%26keywords%3Dsweatshirt%26qid%3D1612402967%26sr%3D8-15-spons%26psc%3D1&qualifier=1612402967&id=7590149187803550&widgetName=sp_mtf
Champion Men's Powerblend Fleece Pullover Sweatshirt,$20.31,4.7 out of 5 stars,"7,967",https://www.amazon.com//Champion-Powerblend-Pullover-Sweatshirt-Medium/dp/B01HIUT1B8/ref=sr_1_16?dchild=1&keywords=sweatshirt&qid=1612402967&sr=8-16
Fruit of the Loom Men's Sofspun Fleece Sweatshirts & Hoodies,$10.13,4.6 out of 5 stars,"9,142",https://www.amazon.com//Fruit-Loom-Sweatshirt-Charcoal-Heather/dp/B018GWYKIQ/ref=sr_1_17?dchild=1&keywords=sweatshirt&qid=1612402967&sr=8-17
Hanes Women's Jersey Full Zip Hoodie,$11.99,4.3 out of 5 stars,"13,717",https://www.amazon.com//Hanes-Womens-Jersey-Hoodie-XX-Large/dp/B016YKL2J2/ref=sr_1_18?dchild=1&keywords=sweatshirt&qid=1612402967&sr=8-18
Russell Athletic Men's Dri-Power Fleece Sweatshirt,$17.00,4.6 out of 5 stars,"7,526",https://www.amazon.com//Russell-Athletic-Dri-Power-Sweatshirt-X-Large/dp/B004J009U8/ref=sr_1_20?dchild=1&keywords=sweatshirt&qid=1612402967&sr=8-20
THE SCOTTS Men's Crewneck Sweatshirt Kanye i like you you're different Sweatshirt Letter Print Sweatshirt Hoodie,$34.99,4.2 out of 5 stars,12,https://www.amazon.com//SCOTTS-Crewneck-Sweatshirt-different-Letter/dp/B08L3B3BFH/ref=sr_1_21?dchild=1&keywords=sweatshirt&qid=1612402967&sr=8-21
Champion Men's Graphic Powerblend Fleece Crew,$25.69,4.7 out of 5 stars,"9,749",https://www.amazon.com//Champion-Graphic-Powerblend-Fleece-Medium/dp/B07DGPSMP3/ref=sr_1_24?dchild=1&keywords=sweatshirt&qid=1612402967&sr=8-24
Gildan Men's Fleece Quarter-Zip Cadet Collar Sweatshirt,$15.14,4.5 out of 5 stars,"5,824",https://www.amazon.com//Gildan-Fleece-Quarter-Zip-Collar-Sweatshirt/dp/B01LX4ITC3/ref=sr_1_25?dchild=1&keywords=sweatshirt&qid=1612402967&sr=8-25
MEN'S NIKE THERMA PULLOVER HOODIE,$59.87,4.9 out of 5 stars,22,https://www.amazon.com//THERMA-PULLOVER-HOODIE-WHITE-Large/dp/B08PYGPKCS/ref=sr_1_26?dchild=1&keywords=sweatshirt&qid=1612402967&sr=8-26
MISFAY Womens Casual Long Sleeve Round Neck Pocket T Shirts Blouses Tunic Sweatshirt Tops with Pocket,$20.99,4.3 out of 5 stars,"2,561",https://www.amazon.com//gp/slredirect/picassoRedirect.html/ref=pa_sp_mtf_aps_sr_pg1_1?ie=UTF8&adId=A0687671IYNK5UEAAQ2Y&url=%2FMISFAY-Womens-Casual-Blouses-Sweatshirt%2Fdp%2FB07Z2QPQ48%2Fref%3Dsr_1_28_sspa%3Fdchild%3D1%26keywords%3Dsweatshirt%26qid%3D1612402967%26sr%3D8-28-spons%26psc%3D1&qualifier=1612402967&id=7590149187803550&widgetName=sp_mtf
FARYSAYS Women's Color Block Sweatshirt Round Neck Long Sleeve Casual Loose Pullover Tops Shirts,$22.98,3.3 out of 5 stars,950,https://www.amazon.com//gp/slredirect/picassoRedirect.html/ref=pa_sp_mtf_aps_sr_pg1_1?ie=UTF8&adId=A011104429RICACYG04B&url=%2FFARYSAYS-Womens-Crewneck-Sweatshirt-Pullover%2Fdp%2FB08KGFWYB7%2Fref%3Dsr_1_29_sspa%3Fdchild%3D1%26keywords%3Dsweatshirt%26qid%3D1612402967%26sr%3D8-29-spons%26psc%3D1&qualifier=1612402967&id=7590149187803550&widgetName=sp_mtf
AUSELILY Women's Long Sleeve Round Neck Casual T Shirts Blouses Sweatshirts Tunic Tops with Pocket,$20.99,4.2 out of 5 stars,"2,903",https://www.amazon.com//gp/slredirect/picassoRedirect.html/ref=pa_sp_mtf_aps_sr_pg1_1?ie=UTF8&adId=A02653401NYF27OUXEPLQ&url=%2FAUSELILY-Leggings-Crewneck-Sweatshirts-Oversized%2Fdp%2FB08M5W3DDZ%2Fref%3Dsr_1_30_sspa%3Fdchild%3D1%26keywords%3Dsweatshirt%26qid%3D1612402967%26sr%3D8-30-spons%26psc%3D1&qualifier=1612402967&id=7590149187803550&widgetName=sp_mtf
Nike Womens Pullover Fleece Hoodie,$44.45,4.5 out of 5 stars,212,https://www.amazon.com//Nike-Womens-Pullover-Fleece-X-Large/dp/B08MQVY8Q2/ref=sr_1_31?dchild=1&keywords=sweatshirt&qid=1612402967&sr=8-31
Century Star Womens Fuzzy Hoodies Pullover Cozy Oversized Pockets Hooded Sweatshirt Athletic Fleece Hoodies,$26.99,4.3 out of 5 stars,"3,289",https://www.amazon.com//Century-Star-Pullover-Oversized-Sweatshirt/dp/B08G4VG11F/ref=sr_1_32?dchild=1&keywords=sweatshirt&qid=1612402967&sr=8-32
Champion Men's Graphic Powerblend Fleece Hoodie,$33.73,4.8 out of 5 stars,"17,617",https://www.amazon.com//Champion-Graphic-Powerblend-Granite-Heather/dp/B078H7ZLQG/ref=sr_1_33?dchild=1&keywords=sweatshirt&qid=1612402967&sr=8-33
Hanes Women's EcoSmart Full-Zip Hoodie Sweatshirt,$11.27,4.5 out of 5 stars,"1,543",https://www.amazon.com//Hanes-Womens-Full-Zip-Splendor-Heather/dp/B07TQNFJ62/ref=sr_1_34?dchild=1&keywords=sweatshirt&qid=1612402967&sr=8-34
Under Armour Men's Armour Fleece Big Logo Hoodie,$37.18,4.8 out of 5 stars,"1,990",https://www.amazon.com//Under-Armour-Fleece-Academy-X-Large/dp/B07YXLQNBK/ref=sr_1_35?dchild=1&keywords=sweatshirt&qid=1612402967&sr=8-35
Champion Women's Powerblend Boyfriend Crew Sweatshirt,$22.89,4.5 out of 5 stars,"2,524",https://www.amazon.com//Champion-Powerblend-Boyfriend-Sweatshirt-Venetian/dp/B07S2SFXWP/ref=sr_1_36?dchild=1&keywords=sweatshirt&qid=1612402967&sr=8-36
PINKMSTYLE Women's Casual Color Block Hoodies Tops Long Sleeve Drawstring Pullover Sweatshirts with Pocket(S-XXL),$21.23,4.6 out of 5 stars,"2,278",https://www.amazon.com//Drawstring-Sweatshirts-Kangaroo-Lightweight-Pullover/dp/B08KQF51LF/ref=sr_1_37_mod_primary_lightning_deal?dchild=1&keywords=sweatshirt&qid=1612402967&sbo=Tc8eqSFhUl4VwMzbE4fw%2Fw%3D%3D&smid=A346U59ZZR17GM&sr=8-37
Yanekop Womens Love Letter Printed Off Shoulder Pullover Sweatshirt Slouchy Tops Shirts,$20.99,4.6 out of 5 stars,"4,220",https://www.amazon.com//Yanekop-Printed-Shoulder-Pullover-Sweatshirt/dp/B07VRMNLVB/ref=sr_1_38?dchild=1&keywords=sweatshirt&qid=1612402967&sr=8-38
"Gildan Women's Fleece Crewneck Sweatshirt, Style G18000fl",$9.86,4.5 out of 5 stars,"3,346",https://www.amazon.com//Gildan-Crewneck-Sweatshirt-Aubergine-X-Large/dp/B076C3VQ5Q/ref=sr_1_39?dchild=1&keywords=sweatshirt&qid=1612402967&sr=8-39
Yanekop Womens Solid Loose Crewneck Sweatshirt Casual Long Sleeve Pullover Tops Shirt,$19.99,3.7 out of 5 stars,65,https://www.amazon.com//Yanekop-Womens-Crewneck-Sweatshirt-Pullover/dp/B08QD38VC8/ref=sr_1_40?dchild=1&keywords=sweatshirt&qid=1612402967&sr=8-40
XUERRY Womens Casual V-NECK Long Sleeves Pocket Solid Color Sweatshirt Tunics Blouse Tops,$17.84,4.1 out of 5 stars,"2,899",https://www.amazon.com//XUERRY-Womens-Casual-Sleeves-Sweatshirt/dp/B07L252HT1/ref=sr_1_42?dchild=1&keywords=sweatshirt&qid=1612402967&sr=8-42
Champion Men's Powerblend Applique Crew,$25.26,4.7 out of 5 stars,813,https://www.amazon.com//Champion-Powerblend-Script-Applique-Medium/dp/B081KMJL7S/ref=sr_1_43?dchild=1&keywords=sweatshirt&qid=1612402967&sr=8-43
Hanes Women's French Terry Full-Zip Hoodie Sweatshirt,$14.10,4.5 out of 5 stars,"8,448",https://www.amazon.com//Hanes-Womens-French-Full-Zip-Hoodie/dp/B01I94LOYE/ref=sr_1_44?dchild=1&keywords=sweatshirt&qid=1612402967&sr=8-44
Amazon Brand - Core 10 Women's Cloud Soft Cropped Flow V-Neck Relaxed Fit Yoga Sweatshirt,$31.10,4.6 out of 5 stars,22,https://www.amazon.com//Amazon-Brand-Cropped-Relaxed-Sweatshirt/dp/B08647ZSYR/ref=sr_1_45?dchild=1&keywords=sweatshirt&qid=1612402967&sr=8-45
Under Armour Men's Rival Fleece Hoodie,$26.99,4.8 out of 5 stars,"1,668",https://www.amazon.com//Under-Armour-Fleece-Academy-X-Large/dp/B07YXN8Q59/ref=sr_1_46?dchild=1&keywords=sweatshirt&qid=1612402967&sr=8-46
Champion Men's Graphic Powerblend Fleece Pullover Hood,$37.49,4.7 out of 5 stars,"5,739",https://www.amazon.com//Champion-Graphic-Powerblend-Fleece-Pullover/dp/B07DGRNZ1W/ref=sr_1_47?dchild=1&keywords=sweatshirt&qid=1612402967&sr=8-47
American Trends Oversized Sweatshirts for Women Athletic Womens Sherpa Hoodie Fluffy Women's Hoodies Pullover with Pockets,$26.99,4.3 out of 5 stars,964,https://www.amazon.com//American-Trends-Sweatshirts-Athletic-Pullover/dp/B08PB9JCR9/ref=sr_1_48?dchild=1&keywords=sweatshirt&qid=1612402967&sr=8-48
Amazon Essentials Women's Classic Fit Lightweight Long-Sleeve V-Neck Sweater,$23.00,4.5 out of 5 stars,"8,033",https://www.amazon.com//Amazon-Essentials-Standard-Lightweight-Sweater/dp/B07QHG3N59/ref=sr_1_49?dchild=1&keywords=sweatshirt&qid=1612402967&sr=8-49
THE SCOTTS Men Crewneck Sweatshirt Kanye I Am Loving Awareness Sweatshirt Vintage Graphic Hip Hop Sweatshirt Hoodie,$37.99,4.6 out of 5 stars,26,https://www.amazon.com//SCOTTS-Crewneck-Sweatshirt-Awareness-Vintage/dp/B08JSMNCRD/ref=sr_1_50?dchild=1&keywords=sweatshirt&qid=1612402967&sr=8-50
Champion Men's Powerblend Graphic Crew,$26.65,4.4 out of 5 stars,421,https://www.amazon.com//Champion-Mens-Powerblend-Graphic-Courageous/dp/B081KQ2ZDT/ref=sr_1_52?dchild=1&keywords=sweatshirt&qid=1612402967&sr=8-52
Amazon Essentials Men's Long-Sleeve Lightweight French Terry Crewneck Sweatshirt,$20.00,4.5 out of 5 stars,866,https://www.amazon.com//Amazon-Essentials-Lightweight-Crewneck-Sweatshirt/dp/B07VTQ6RH6/ref=sr_1_53?dchild=1&keywords=sweatshirt&qid=1612402967&sr=8-53
KIRUNDO 2021 Women’s Tie Dye Sporty Sweatshirt Crew Neck Long Sleeves Pullover Ribbed Cuffs Hems Sweaters Outwear,$28.99,4.0 out of 5 stars,"1,839",https://www.amazon.com//KIRUNDO-Sweatshirt-Pullover-Sweaters-Split-Light/dp/B08DCTN62F/ref=sr_1_54?dchild=1&keywords=sweatshirt&qid=1612402967&sr=8-54
Painted Heart Women's Open Back Crew Neck Sweatshirt,$12.99,4.8 out of 5 stars,10,https://www.amazon.com//gp/slredirect/picassoRedirect.html/ref=pa_sp_btf_aps_sr_pg1_1?ie=UTF8&adId=A0599753391K7T8VUX3DS&url=%2FPainted-Heart-Sweatshirt-X-Large-Heather%2Fdp%2FB07GT2FWK8%2Fref%3Dsr_1_55_sspa%3Fdchild%3D1%26keywords%3Dsweatshirt%26qid%3D1612402967%26sr%3D8-55-spons%26psc%3D1&qualifier=1612402967&id=7590149187803550&widgetName=sp_btf
CQC Women's Long Sleeve Fleece Sweatshirt Workout Running Casual Crew Neck Pullover Tops,$23.99,4.3 out of 5 stars,41,https://www.amazon.com//gp/slredirect/picassoRedirect.html/ref=pa_sp_btf_aps_sr_pg1_1?ie=UTF8&adId=A0427955480QQ7BYJ0RL&url=%2FCQC-Sweatshirt-Workout-Running-Pullover%2Fdp%2FB08DHFZ5BK%2Fref%3Dsr_1_56_sspa%3Fdchild%3D1%26keywords%3Dsweatshirt%26qid%3D1612402967%26sr%3D8-56-spons%26psc%3D1&qualifier=1612402967&id=7590149187803550&widgetName=sp_btf
"Romanstii Cowl Neck Sweatshirts for Women - Casual Cute Long Sleeve Sweaters, Zip Pullover Shirts Blouses Tops with Pockets",$23.99,4.3 out of 5 stars,295,https://www.amazon.com//gp/slredirect/picassoRedirect.html/ref=pa_sp_btf_aps_sr_pg1_1?ie=UTF8&adId=A00019105JJ2ZH82MH4Y&url=%2FRomanstii-Oversized-Sweaters-Pullover-Quarter-Zip%2Fdp%2FB08DFNCKHG%2Fref%3Dsr_1_57_sspa%3Fdchild%3D1%26keywords%3Dsweatshirt%26qid%3D1612402967%26sr%3D8-57-spons%26psc%3D1&qualifier=1612402967&id=7590149187803550&widgetName=sp_btf
NGOZI Womens Crew Neck Raglan Sleeve Shirt Slouchy Pullover Sweatshirts with Pockets 1X-4X,$12.99,2.6 out of 5 stars,19,https://www.amazon.com//gp/slredirect/picassoRedirect.html/ref=pa_sp_btf_aps_sr_pg1_1?ie=UTF8&adId=A095175334KDM2YL43F57&url=%2FNGOZI-Slouchy-Pullover-Sweatshirts-Pockets%2Fdp%2FB08FKWLVL8%2Fref%3Dsr_1_58_sspa%3Fdchild%3D1%26keywords%3Dsweatshirt%26qid%3D1612402967%26sr%3D8-58-spons%26psc%3D1&qualifier=1612402967&id=7590149187803550&widgetName=sp_btf
Aleumdr Women Casual Long Sleeve 1/4 Zipper Color Block Sweatshirts Stand Collar Pullover Tunic Tops with Pockets S-XXL,$29.76,4.3 out of 5 stars,"5,527",https://www.amazon.com//gp/slredirect/picassoRedirect.html/ref=pa_sp_btf_aps_sr_pg1_1?ie=UTF8&adId=A00239571X9FH2G5MYMEC&url=%2FAleumdr-Pullover-Quarter-Sweatshirts-Pockets%2Fdp%2FB07YRL3JXN%2Fref%3Dsr_1_59_sspa%3Fdchild%3D1%26keywords%3Dsweatshirt%26qid%3D1612402967%26sr%3D8-59-spons%26psc%3D1%26smid%3DA134GXQ5I7Y79N&qualifier=1612402967&id=7590149187803550&widgetName=sp_btf
Adult Soft and Cozy Crewneck Sweatshirts in 28 Colors in Sizes S-4XL,$23.99,4.5 out of 5 stars,"1,377",https://www.amazon.com//gp/slredirect/picassoRedirect.html/ref=pa_sp_btf_aps_sr_pg1_1?ie=UTF8&adId=A02215411M1WJC3N63XOD&url=%2FJoes-USA-Classic-Crewneck-Sweatshirt%2Fdp%2FB00ML71HVG%2Fref%3Dsr_1_60_sspa%3Fdchild%3D1%26keywords%3Dsweatshirt%26qid%3D1612402967%26sr%3D8-60-spons%26psc%3D1%26smid%3DA2ROZC5KOIO6QV&qualifier=1612402967&id=7590149187803550&widgetName=sp_btf
Amazon Essentials Men's Fleece Crewneck Sweatshirt,$15.00,4.6 out of 5 stars,"12,719",https://www.amazon.com//gp/slredirect/picassoRedirect.html/ref=pa_sp_atf_aps_sr_pg1_1?ie=UTF8&adId=A0446031ZHCEP1J3FHFU&url=%2FAmazon-Essentials-Crewneck-Fleece-Sweatshirt%2Fdp%2FB07BN3XSHD%2Fref%3Dsr_1_1_sspa%3Fdchild%3D1%26keywords%3Dsweatshirt%26qid%3D1612402973%26sr%3D8-1-spons%26psc%3D1&qualifier=1612402973&id=190560181863610&widgetName=sp_atf
YSYOKOW Womens Casual Loose T Shirts Short/Long Sleeve Blouses Tunic Tops with Pockets,$21.99,4.5 out of 5 stars,"2,944",https://www.amazon.com//gp/slredirect/picassoRedirect.html/ref=pa_sp_atf_aps_sr_pg1_1?ie=UTF8&adId=A01526731YTHH3BPW02SD&url=%2FYSYOKOW-Womens-Blouses-Pockets-X-Large%2Fdp%2FB08HZ2TB41%2Fref%3Dsr_1_2_sspa%3Fdchild%3D1%26keywords%3Dsweatshirt%26qid%3D1612402973%26sr%3D8-2-spons%26psc%3D1&qualifier=1612402973&id=190560181863610&widgetName=sp_atf
Hanes Men's Ecosmart Fleece Sweatshirt,$11.00,4.6 out of 5 stars,"71,658",https://www.amazon.com//Hanes-Ecosmart-Fleece-Sweatshirt-Black/dp/B01L8JJ57U/ref=sr_1_3?dchild=1&keywords=sweatshirt&qid=1612402973&sr=8-3
Hanes Mens Pullover Ecosmart Fleece Hooded Sweatshirt,$14.50,4.6 out of 5 stars,"78,325",https://www.amazon.com//Hanes-Pullover-Ecosmart-Sweatshirt-Charcoal/dp/B01L8JJY08/ref=sr_1_4?dchild=1&keywords=sweatshirt&qid=1612402973&sr=8-4
"Gildan Men's Fleece Crewneck Sweatshirt, Style G18000",$15.00,4.7 out of 5 stars,"29,110",https://www.amazon.com//Gildan-Fleece-Crewneck-Sweatshirt-White/dp/B07M61KLP3/ref=sr_1_5?dchild=1&keywords=sweatshirt&qid=1612402973&sr=8-5
Hanes Men's Comfortwash Garment Dyed Fleece Sweatshirt,$14.56,4.7 out of 5 stars,"6,965",https://www.amazon.com//Hanes-ComfortWash-Garment-Sweatshirt-Cypress/dp/B07JYRDQ7Q/ref=sr_1_6?dchild=1&keywords=sweatshirt&qid=1612402973&sr=8-6
Bingerlily Women's Casual Hoodies Long Sleeve Solid Lightweight Pullover Tops Loose Sweatshirt with Pocket,$22.97,4.3 out of 5 stars,"1,467",https://www.amazon.com//Bingerlily-Hoodies-Lightweight-Pullover-Sweatshirt/dp/B08JHXX4SF/ref=sr_1_9?dchild=1&keywords=sweatshirt&qid=1612402973&sr=8-9
"Gildan Men's Fleece Hooded Sweatshirt, Style G18500",$14.50,4.6 out of 5 stars,"50,503",https://www.amazon.com//Gildan-Fleece-Sweatshirt-G18500-Heather/dp/B014RQ1LA0/ref=sr_1_10?dchild=1&keywords=sweatshirt&qid=1612402973&sr=8-10
Champion Men's Powerblend Fleece Pullover Hoodie,$23.15,4.7 out of 5 stars,"26,502",https://www.amazon.com//Champion-Powerblend-Pullover-Granite-Heather/dp/B01HIUTE1K/ref=sr_1_12?dchild=1&keywords=sweatshirt&qid=1612402973&sr=8-12
Amazon Essentials Men's Fleece Crewneck Sweatshirt,$15.00,4.6 out of 5 stars,"12,719",https://www.amazon.com//Amazon-Essentials-Crewneck-Fleece-Sweatshirt/dp/B07BN3XSHD/ref=sr_1_13?dchild=1&keywords=sweatshirt&qid=1612402973&sr=8-13
Hanes Men's Ultimate Cotton Heavyweight Crewneck Sweatshirt,$15.37,4.5 out of 5 stars,"11,571",https://www.amazon.com//Hanes-Ultimate-Heavyweight-Sweatshirt-X-Large/dp/B00JUMCTRQ/ref=sr_1_14?dchild=1&keywords=sweatshirt&qid=1612402973&sr=8-14
